{
  "$id": "https://posthog-impact.local/schemas/reviews.schema.json",
  "$schema": "https://json-schema.org/draft/2020-12/schema",
  "additionalProperties": false,
  "properties": {
    "body_length": {
      "arrow_type": "int64",
      "type": [
        "integer",
        "null"
      ]
    },
    "body_text": {
      "arrow_type": "string",
      "type": [
        "string",
        "null"
      ]
    },
    "commit_sha": {
      "arrow_type": "string",
      "type": [
        "string",
        "null"
      ]
    },
    "computed_at": {
      "arrow_type": "string",
      "type": [
        "string",
        "null"
      ]
    },
    "created_at": {
      "arrow_type": "string",
      "type": [
        "string",
        "null"
      ]
    },
    "database_id": {
      "arrow_type": "int64",
      "type": [
        "integer",
        "null"
      ]
    },
    "pr_id": {
      "arrow_type": "string",
      "type": [
        "string",
        "null"
      ]
    },
    "pr_number": {
      "arrow_type": "int64",
      "type": [
        "integer",
        "null"
      ]
    },
    "review_id": {
      "arrow_type": "string",
      "type": [
        "string",
        "null"
      ]
    },
    "reviewer_actor_id": {
      "arrow_type": "string",
      "type": [
        "string",
        "null"
      ]
    },
    "reviewer_login": {
      "arrow_type": "string",
      "type": [
        "string",
        "null"
      ]
    },
    "reviewer_typename": {
      "arrow_type": "string",
      "type": [
        "string",
        "null"
      ]
    },
    "state": {
      "arrow_type": "string",
      "type": [
        "string",
        "null"
      ]
    },
    "submitted_at": {
      "arrow_type": "string",
      "type": [
        "string",
        "null"
      ]
    },
    "updated_at": {
      "arrow_type": "string",
      "type": [
        "string",
        "null"
      ]
    },
    "url": {
      "arrow_type": "string",
      "type": [
        "string",
        "null"
      ]
    }
  },
  "title": "reviews",
  "type": "object",
  "x-pipeline-version": "1.0.0",
  "x-schema-version": "1.0.0"
}
