[
  {
    "body_length": 1392,
    "body_text": "Pull request overview\nThis PR consolidates scattered development environment variables from multiple startup scripts (bin/start, bin/start-backend, bin/start-celery) into a single committed .env.devel",
    "commit_sha": "21314a6010a187c88237d070efbda6acd2feb326",
    "computed_at": "2026-08-17T14:45:30.050059Z",
    "created_at": "2026-01-22T13:40:43Z",
    "database_id": 3692513228,
    "pr_id": "github.com/PostHog/posthog#pr/45696",
    "pr_number": 45696,
    "review_id": "PRR_kwDODg-Tdc7cF0fM",
    "reviewer_actor_id": "github/user/copilot-pull-request-reviewer",
    "reviewer_login": "copilot-pull-request-reviewer",
    "reviewer_typename": "Bot",
    "state": "COMMENTED",
    "submitted_at": "2026-01-22T13:40:43Z",
    "updated_at": "2026-01-22T13:40:43Z",
    "url": "https://github.com/PostHog/posthog/pull/45696#pullrequestreview-3692513228"
  },
  {
    "body_length": 483,
    "body_text": "\ud83d\udca1 Codex Review\nHere are some automated review suggestions for this pull request.\nReviewed commit: 21314a6010\n \u2139\ufe0f About Codex in GitHub\n\nYour team has set up Codex to review pull requests in this repo.",
    "commit_sha": "21314a6010a187c88237d070efbda6acd2feb326",
    "computed_at": "2026-08-17T14:45:30.050085Z",
    "created_at": "2026-01-22T13:41:38Z",
    "database_id": 3692516960,
    "pr_id": "github.com/PostHog/posthog#pr/45696",
    "pr_number": 45696,
    "review_id": "PRR_kwDODg-Tdc7cF1Zg",
    "reviewer_actor_id": "github/user/chatgpt-codex-connector",
    "reviewer_login": "chatgpt-codex-connector",
    "reviewer_typename": "Bot",
    "state": "COMMENTED",
    "submitted_at": "2026-01-22T13:41:37Z",
    "updated_at": "2026-01-22T13:41:38Z",
    "url": "https://github.com/PostHog/posthog/pull/45696#pullrequestreview-3692516960"
  },
  {
    "body_length": 541,
    "body_text": "Additional Comments (1)\n\n\nbin/start-worker, line 7-10 (link)\nlogic: These hardcoded ClickHouse credentials are duplicates from .env.development (lines 13-16) and should be removed for consistency with",
    "commit_sha": "21314a6010a187c88237d070efbda6acd2feb326",
    "computed_at": "2026-08-17T14:45:30.050028Z",
    "created_at": "2026-01-22T13:35:54Z",
    "database_id": 3692493178,
    "pr_id": "github.com/PostHog/posthog#pr/45696",
    "pr_number": 45696,
    "review_id": "PRR_kwDODg-Tdc7cFvl6",
    "reviewer_actor_id": "github/user/greptile-apps",
    "reviewer_login": "greptile-apps",
    "reviewer_typename": "Bot",
    "state": "COMMENTED",
    "submitted_at": "2026-01-22T13:38:13Z",
    "updated_at": "2026-01-22T13:38:15Z",
    "url": "https://github.com/PostHog/posthog/pull/45696#pullrequestreview-3692493178"
  },
  {
    "body_length": 0,
    "body_text": "",
    "commit_sha": "21314a6010a187c88237d070efbda6acd2feb326",
    "computed_at": "2026-08-17T14:45:30.050095Z",
    "created_at": "2026-01-22T13:38:30Z",
    "database_id": 3692504129,
    "pr_id": "github.com/PostHog/posthog#pr/45696",
    "pr_number": 45696,
    "review_id": "PRR_kwDODg-Tdc7cFyRB",
    "reviewer_actor_id": "github/user/graphite-app",
    "reviewer_login": "graphite-app",
    "reviewer_typename": "Bot",
    "state": "COMMENTED",
    "submitted_at": "2026-01-28T08:19:04Z",
    "updated_at": "2026-01-28T08:19:04Z",
    "url": "https://github.com/PostHog/posthog/pull/45696#pullrequestreview-3692504129"
  },
  {
    "body_length": 0,
    "body_text": "",
    "commit_sha": "ef3f143762f85ede7c7a913647b1ad15838e59cd",
    "computed_at": "2026-08-17T14:45:30.050107Z",
    "created_at": "2026-01-28T09:05:37Z",
    "database_id": 3715423581,
    "pr_id": "github.com/PostHog/posthog#pr/45696",
    "pr_number": 45696,
    "review_id": "PRR_kwDODg-Tdc7ddN1d",
    "reviewer_actor_id": "github/user/webjunkie",
    "reviewer_login": "webjunkie",
    "reviewer_typename": "User",
    "state": "COMMENTED",
    "submitted_at": "2026-01-28T09:05:37Z",
    "updated_at": "2026-01-28T09:05:37Z",
    "url": "https://github.com/PostHog/posthog/pull/45696#pullrequestreview-3715423581"
  },
  {
    "body_length": 0,
    "body_text": "",
    "commit_sha": "6193f291c0f89a1b96eb6ddfa5e7265b091e2aef",
    "computed_at": "2026-08-17T14:45:30.050115Z",
    "created_at": "2026-01-28T09:11:38Z",
    "database_id": 3715456766,
    "pr_id": "github.com/PostHog/posthog#pr/45696",
    "pr_number": 45696,
    "review_id": "PRR_kwDODg-Tdc7ddV7-",
    "reviewer_actor_id": "github/user/graphite-app",
    "reviewer_login": "graphite-app",
    "reviewer_typename": "Bot",
    "state": "COMMENTED",
    "submitted_at": "2026-01-28T09:23:06Z",
    "updated_at": "2026-01-28T09:23:06Z",
    "url": "https://github.com/PostHog/posthog/pull/45696#pullrequestreview-3715456766"
  },
  {
    "body_length": 165,
    "body_text": "@oliverb123 FYI, not sure if you use hogli or not, but some stuff might break if you don't start using it - or you update your local env to follow these expectations",
    "commit_sha": "512a89721a5e27ecce6be287b7b29f003784c374",
    "computed_at": "2026-08-17T14:45:30.050136Z",
    "created_at": "2026-01-29T20:59:07Z",
    "database_id": 3725026822,
    "pr_id": "github.com/PostHog/posthog#pr/45696",
    "pr_number": 45696,
    "review_id": "PRR_kwDODg-Tdc7eB2YG",
    "reviewer_actor_id": "github/user/rafaeelaudibert",
    "reviewer_login": "rafaeelaudibert",
    "reviewer_typename": "User",
    "state": "COMMENTED",
    "submitted_at": "2026-01-29T20:59:23Z",
    "updated_at": "2026-01-29T20:59:23Z",
    "url": "https://github.com/PostHog/posthog/pull/45696#pullrequestreview-3725026822"
  },
  {
    "body_length": 0,
    "body_text": "",
    "commit_sha": "512a89721a5e27ecce6be287b7b29f003784c374",
    "computed_at": "2026-08-17T14:45:30.050127Z",
    "created_at": "2026-01-29T20:55:39Z",
    "database_id": 3725015401,
    "pr_id": "github.com/PostHog/posthog#pr/45696",
    "pr_number": 45696,
    "review_id": "PRR_kwDODg-Tdc7eBzlp",
    "reviewer_actor_id": "github/user/rafaeelaudibert",
    "reviewer_login": "rafaeelaudibert",
    "reviewer_typename": "User",
    "state": "COMMENTED",
    "submitted_at": "2026-01-29T20:55:39Z",
    "updated_at": "2026-01-29T20:55:39Z",
    "url": "https://github.com/PostHog/posthog/pull/45696#pullrequestreview-3725015401"
  },
  {
    "body_length": 0,
    "body_text": "",
    "commit_sha": "512a89721a5e27ecce6be287b7b29f003784c374",
    "computed_at": "2026-08-17T14:45:30.050143Z",
    "created_at": "2026-01-30T08:28:03Z",
    "database_id": 3726983998,
    "pr_id": "github.com/PostHog/posthog#pr/45696",
    "pr_number": 45696,
    "review_id": "PRR_kwDODg-Tdc7eJUM-",
    "reviewer_actor_id": "github/user/webjunkie",
    "reviewer_login": "webjunkie",
    "reviewer_typename": "User",
    "state": "COMMENTED",
    "submitted_at": "2026-01-30T08:28:03Z",
    "updated_at": "2026-01-30T08:28:03Z",
    "url": "https://github.com/PostHog/posthog/pull/45696#pullrequestreview-3726983998"
  },
  {
    "body_length": 0,
    "body_text": "",
    "commit_sha": "512a89721a5e27ecce6be287b7b29f003784c374",
    "computed_at": "2026-08-17T14:45:30.050150Z",
    "created_at": "2026-01-30T12:43:21Z",
    "database_id": 3728097208,
    "pr_id": "github.com/PostHog/posthog#pr/45696",
    "pr_number": 45696,
    "review_id": "PRR_kwDODg-Tdc7eNj-4",
    "reviewer_actor_id": "github/user/rafaeelaudibert",
    "reviewer_login": "rafaeelaudibert",
    "reviewer_typename": "User",
    "state": "COMMENTED",
    "submitted_at": "2026-01-30T12:43:22Z",
    "updated_at": "2026-01-30T12:43:22Z",
    "url": "https://github.com/PostHog/posthog/pull/45696#pullrequestreview-3728097208"
  },
  {
    "body_length": 0,
    "body_text": "",
    "commit_sha": "512a89721a5e27ecce6be287b7b29f003784c374",
    "computed_at": "2026-08-17T14:45:30.050166Z",
    "created_at": "2026-05-18T13:45:24Z",
    "database_id": 4310697596,
    "pr_id": "github.com/PostHog/posthog#pr/45696",
    "pr_number": 45696,
    "review_id": "PRR_kwDODg-Tdc8AAAABAPAGfA",
    "reviewer_actor_id": "github/user/oliverb123",
    "reviewer_login": "oliverb123",
    "reviewer_typename": "User",
    "state": "APPROVED",
    "submitted_at": "2026-05-18T13:45:24Z",
    "updated_at": "2026-05-18T13:45:24Z",
    "url": "https://github.com/PostHog/posthog/pull/45696#pullrequestreview-4310697596"
  },
  {
    "body_length": 483,
    "body_text": "\ud83d\udca1 Codex Review\nHere are some automated review suggestions for this pull request.\nReviewed commit: cb30978533\n \u2139\ufe0f About Codex in GitHub\n\nYour team has set up Codex to review pull requests in this repo.",
    "commit_sha": "cb3097853394dfea4c492957602e1e5e7507a2f7",
    "computed_at": "2026-08-17T14:45:30.050179Z",
    "created_at": "2026-05-19T11:49:48Z",
    "database_id": 4318589734,
    "pr_id": "github.com/PostHog/posthog#pr/45696",
    "pr_number": 45696,
    "review_id": "PRR_kwDODg-Tdc8AAAABAWhzJg",
    "reviewer_actor_id": "github/user/chatgpt-codex-connector",
    "reviewer_login": "chatgpt-codex-connector",
    "reviewer_typename": "Bot",
    "state": "COMMENTED",
    "submitted_at": "2026-05-19T11:49:48Z",
    "updated_at": "2026-05-19T11:49:49Z",
    "url": "https://github.com/PostHog/posthog/pull/45696#pullrequestreview-4318589734"
  },
  {
    "body_length": 111,
    "body_text": "Pull request overview\nCopilot reviewed 8 out of 16 changed files in this pull request and generated 3 comments.",
    "commit_sha": "31c48feb8dfd29824f645d87eac72770f50777ea",
    "computed_at": "2026-08-17T14:45:30.050186Z",
    "created_at": "2026-05-19T11:52:00Z",
    "database_id": 4318603762,
    "pr_id": "github.com/PostHog/posthog#pr/45696",
    "pr_number": 45696,
    "review_id": "PRR_kwDODg-Tdc8AAAABAWip8g",
    "reviewer_actor_id": "github/user/copilot-pull-request-reviewer",
    "reviewer_login": "copilot-pull-request-reviewer",
    "reviewer_typename": "Bot",
    "state": "COMMENTED",
    "submitted_at": "2026-05-19T11:52:02Z",
    "updated_at": "2026-05-19T11:52:02Z",